{
  "service": "google",
  "updated_at": "2026-06-18",
  "schema_version": "1",
  "entries": [
    {
      "type": "ip_range",
      "value": "8.8.4.0/24",
      "action": "DIRECT"
    },
    {
      "type": "ip_range",
      "value": "8.8.8.0/24",
      "action": "DIRECT"
    },
    {
      "type": "ip_range",
      "value": "8.34.208.0/20",
      "action": "DIRECT"
    },
    {
      "type": "ip_range",
      "value": "8.35.192.0/20",
      "action": "DIRECT"
    },
    {
      "type": "ip_range",
      "value": "8.228.0.0/14",
      "action": "DIRECT"
    },
    {
      "type": "ip_range",
      "value": "8.232.0.0/14",
      "action": "DIRECT"
    },
    {
      "type": "ip_range",
      "value": "8.236.0.0/15",
      "action": "DIRECT"
    },
    {
      "type": "ip_range",
      "value": "23.236.48.0/20",
      "action": "DIRECT"
    },
    {
      "type": "ip_range",
      "value": "23.251.128.0/19",
      "action": "DIRECT"
    },
    {
      "type": "ip_range",
      "value": "34.0.0.0/15",
      "action": "DIRECT"
    },
    {
      "type": "ip_range",
      "value": "34.2.0.0/16",
      "action": "DIRECT"
    },
    {
      "type": "ip_range",
      "value": "34.3.0.0/23",
      "action": "DIRECT"
    },
    {
      "type": "ip_range",
      "value": "34.3.3.0/24",
      "action": "DIRECT"
    },
    {
      "type": "ip_range",
      "value": "34.3.4.0/24",
      "action": "DIRECT"
    },
    {
      "type": "ip_range",
      "value": "34.3.8.0/21",
      "action": "DIRECT"
    },
    {
      "type": "ip_range",
      "value": "34.3.16.0/20",
      "action": "DIRECT"
    },
    {
      "type": "ip_range",
      "value": "34.3.32.0/19",
      "action": "DIRECT"
    },
    {
      "type": "ip_range",
      "value": "34.3.64.0/18",
      "action": "DIRECT"
    },
    {
      "type": "ip_range",
      "value": "34.4.0.0/14",
      "action": "DIRECT"
    },
    {
      "type": "ip_range",
      "value": "34.8.0.0/13",
      "action": "DIRECT"
    },
    {
      "type": "ip_range",
      "value": "34.16.0.0/12",
      "action": "DIRECT"
    },
    {
      "type": "ip_range",
      "value": "34.32.0.0/11",
      "action": "DIRECT"
    },
    {
      "type": "ip_range",
      "value": "34.64.0.0/10",
      "action": "DIRECT"
    },
    {
      "type": "ip_range",
      "value": "34.128.0.0/10",
      "action": "DIRECT"
    },
    {
      "type": "ip_range",
      "value": "35.184.0.0/13",
      "action": "DIRECT"
    },
    {
      "type": "ip_range",
      "value": "35.192.0.0/14",
      "action": "DIRECT"
    },
    {
      "type": "ip_range",
      "value": "35.196.0.0/15",
      "action": "DIRECT"
    },
    {
      "type": "ip_range",
      "value": "35.198.0.0/16",
      "action": "DIRECT"
    },
    {
      "type": "ip_range",
      "value": "35.199.0.0/17",
      "action": "DIRECT"
    },
    {
      "type": "ip_range",
      "value": "35.199.128.0/18",
      "action": "DIRECT"
    },
    {
      "type": "ip_range",
      "value": "35.200.0.0/13",
      "action": "DIRECT"
    },
    {
      "type": "ip_range",
      "value": "35.208.0.0/12",
      "action": "DIRECT"
    },
    {
      "type": "ip_range",
      "value": "35.224.0.0/12",
      "action": "DIRECT"
    },
    {
      "type": "ip_range",
      "value": "35.240.0.0/13",
      "action": "DIRECT"
    },
    {
      "type": "ip_range",
      "value": "35.252.0.0/14",
      "action": "DIRECT"
    },
    {
      "type": "ip_range",
      "value": "64.15.112.0/20",
      "action": "DIRECT"
    },
    {
      "type": "ip_range",
      "value": "64.233.160.0/19",
      "action": "DIRECT"
    },
    {
      "type": "ip_range",
      "value": "66.102.0.0/20",
      "action": "DIRECT"
    },
    {
      "type": "ip_range",
      "value": "66.249.64.0/19",
      "action": "DIRECT"
    },
    {
      "type": "ip_range",
      "value": "70.32.128.0/19",
      "action": "DIRECT"
    },
    {
      "type": "ip_range",
      "value": "72.14.192.0/18",
      "action": "DIRECT"
    },
    {
      "type": "ip_range",
      "value": "74.114.24.0/21",
      "action": "DIRECT"
    },
    {
      "type": "ip_range",
      "value": "74.125.0.0/16",
      "action": "DIRECT"
    },
    {
      "type": "ip_range",
      "value": "104.154.0.0/15",
      "action": "DIRECT"
    },
    {
      "type": "ip_range",
      "value": "104.196.0.0/14",
      "action": "DIRECT"
    },
    {
      "type": "ip_range",
      "value": "104.237.160.0/19",
      "action": "DIRECT"
    },
    {
      "type": "ip_range",
      "value": "107.167.160.0/19",
      "action": "DIRECT"
    },
    {
      "type": "ip_range",
      "value": "107.178.192.0/18",
      "action": "DIRECT"
    },
    {
      "type": "ip_range",
      "value": "108.59.80.0/20",
      "action": "DIRECT"
    },
    {
      "type": "ip_range",
      "value": "108.170.192.0/18",
      "action": "DIRECT"
    },
    {
      "type": "ip_range",
      "value": "108.177.0.0/17",
      "action": "DIRECT"
    },
    {
      "type": "ip_range",
      "value": "130.211.0.0/16",
      "action": "DIRECT"
    },
    {
      "type": "ip_range",
      "value": "136.22.2.0/23",
      "action": "DIRECT"
    },
    {
      "type": "ip_range",
      "value": "136.22.4.0/23",
      "action": "DIRECT"
    },
    {
      "type": "ip_range",
      "value": "136.22.8.0/22",
      "action": "DIRECT"
    },
    {
      "type": "ip_range",
      "value": "136.22.160.0/20",
      "action": "DIRECT"
    },
    {
      "type": "ip_range",
      "value": "136.22.176.0/21",
      "action": "DIRECT"
    },
    {
      "type": "ip_range",
      "value": "136.22.184.0/23",
      "action": "DIRECT"
    },
    {
      "type": "ip_range",
      "value": "136.22.186.0/24",
      "action": "DIRECT"
    },
    {
      "type": "ip_range",
      "value": "136.23.48.0/20",
      "action": "DIRECT"
    },
    {
      "type": "ip_range",
      "value": "136.23.64.0/18",
      "action": "DIRECT"
    },
    {
      "type": "ip_range",
      "value": "136.64.0.0/11",
      "action": "DIRECT"
    },
    {
      "type": "ip_range",
      "value": "136.107.0.0/16",
      "action": "DIRECT"
    },
    {
      "type": "ip_range",
      "value": "136.108.0.0/14",
      "action": "DIRECT"
    },
    {
      "type": "ip_range",
      "value": "136.112.0.0/13",
      "action": "DIRECT"
    },
    {
      "type": "ip_range",
      "value": "136.120.0.0/22",
      "action": "DIRECT"
    },
    {
      "type": "ip_range",
      "value": "136.121.8.0/21",
      "action": "DIRECT"
    },
    {
      "type": "ip_range",
      "value": "136.124.0.0/15",
      "action": "DIRECT"
    },
    {
      "type": "ip_range",
      "value": "142.250.0.0/15",
      "action": "DIRECT"
    },
    {
      "type": "ip_range",
      "value": "146.148.0.0/17",
      "action": "DIRECT"
    },
    {
      "type": "ip_range",
      "value": "162.120.128.0/17",
      "action": "DIRECT"
    },
    {
      "type": "ip_range",
      "value": "162.216.148.0/22",
      "action": "DIRECT"
    },
    {
      "type": "ip_range",
      "value": "162.222.176.0/21",
      "action": "DIRECT"
    },
    {
      "type": "ip_range",
      "value": "172.110.32.0/21",
      "action": "DIRECT"
    },
    {
      "type": "ip_range",
      "value": "172.217.0.0/16",
      "action": "DIRECT"
    },
    {
      "type": "ip_range",
      "value": "172.253.0.0/16",
      "action": "DIRECT"
    },
    {
      "type": "ip_range",
      "value": "173.194.0.0/16",
      "action": "DIRECT"
    },
    {
      "type": "ip_range",
      "value": "173.255.112.0/20",
      "action": "DIRECT"
    },
    {
      "type": "ip_range",
      "value": "192.104.160.0/23",
      "action": "DIRECT"
    },
    {
      "type": "ip_range",
      "value": "192.158.28.0/22",
      "action": "DIRECT"
    },
    {
      "type": "ip_range",
      "value": "192.178.0.0/15",
      "action": "DIRECT"
    },
    {
      "type": "ip_range",
      "value": "193.186.4.0/24",
      "action": "DIRECT"
    },
    {
      "type": "ip_range",
      "value": "199.36.154.0/23",
      "action": "DIRECT"
    },
    {
      "type": "ip_range",
      "value": "199.36.156.0/24",
      "action": "DIRECT"
    },
    {
      "type": "ip_range",
      "value": "199.192.112.0/22",
      "action": "DIRECT"
    },
    {
      "type": "ip_range",
      "value": "199.223.232.0/21",
      "action": "DIRECT"
    },
    {
      "type": "ip_range",
      "value": "207.175.0.0/16",
      "action": "DIRECT"
    },
    {
      "type": "ip_range",
      "value": "207.223.160.0/20",
      "action": "DIRECT"
    },
    {
      "type": "ip_range",
      "value": "208.65.152.0/22",
      "action": "DIRECT"
    },
    {
      "type": "ip_range",
      "value": "208.68.108.0/22",
      "action": "DIRECT"
    },
    {
      "type": "ip_range",
      "value": "208.81.188.0/22",
      "action": "DIRECT"
    },
    {
      "type": "ip_range",
      "value": "208.117.224.0/19",
      "action": "DIRECT"
    },
    {
      "type": "ip_range",
      "value": "209.85.128.0/17",
      "action": "DIRECT"
    },
    {
      "type": "ip_range",
      "value": "216.58.192.0/19",
      "action": "DIRECT"
    },
    {
      "type": "ip_range",
      "value": "216.73.80.0/20",
      "action": "DIRECT"
    },
    {
      "type": "ip_range",
      "value": "216.239.32.0/19",
      "action": "DIRECT"
    },
    {
      "type": "ip_range",
      "value": "216.252.220.0/22",
      "action": "DIRECT"
    }
  ]
}
